<?xml version="1.0" encoding="UTF-8"?>
<pcdl xmlns:xsi="http://www.w3.org/2001/XMLSchema-instance" xsi:noNamespaceSchemaLocation="pcdl.xsd" version="1.1">
<MigrationTool id="x-sfw/381">
<GeneralInfo>
<Name>ImageIO</Name>
    <Version>fake</Version>
    <Description>
this pcdl descriptor is for testing purposes only

    </Description>
    <Location>http://www.imagemagick.org/</Location>
<CreationDate>2009-12-27</CreationDate>
<Developer>
    <Name>ImageMagick Studio LLC</Name>
<Source>
<SuppliedBy>
<Name>Administrator</Name>
<Website>http://www.institute.com/johndoe</Website>
<Mail>johndoe@institute.org</Mail>
</SuppliedBy>
<SuppliedAt>2010-01-08T12:08:00</SuppliedAt>
<LastModifiedBy>
<Name>AnotherAdministrator</Name>
<Website>http://www.institute.org/another</Website>
<Mail>another@institute.org</Mail>
</LastModifiedBy>
<LastModifiedAt>2010-01-08T19:30:00</LastModifiedAt>
</Source>
</Developer>
    <Interface>
        <InputFormat>
            <File type="fmt/41" optional="true"/>
            <File type="fmt/42" optional="true"/>
            <File type="fmt/43" optional="true"/>
            <File type="fmt/44" optional="true"/>
            <File type="fmt/112" optional="true"/>
        </InputFormat>
        <InputMaxSize>
            <Amount>512</Amount>
        </InputMaxSize>
        <InterfaceType>GUI</InterfaceType>
        <InterfaceType>Command line</InterfaceType>
        <InterfaceType>API</InterfaceType>
        <ProgrammingInterface>true</ProgrammingInterface>
        <Languages>
            <Language>en</Language>
            <Language>de</Language>
            <Language>it</Language>
        </Languages>
    </Interface>
    <Licensing>
        <PriceEUROS>0</PriceEUROS>
        <License>GPL</License>
        <OpenSource>true</OpenSource>
        <Schema>openSource</Schema>
    </Licensing>
    <Documentation>
        <UserGuide>
            <Creator>
                <Name>unknown</Name>
            </Creator>
            <Location>http://www.imagemagick.org/script/convert.php?ImageMagick=55afgl5qq851oqh66thkbnba84</Location>
            <ReleaseDate>2000-10-06</ReleaseDate>
        </UserGuide>
    </Documentation>
</GeneralInfo>
<HostEnvironment>
<OperatingSystem>sfw/183</OperatingSystem>
<OperatingSystem>x-sfw/37</OperatingSystem>
<OperatingSystem>x-sfw/31</OperatingSystem>
<OperatingSystem>x-sfw/9</OperatingSystem>
<OperatingSystem>x-sfw/8</OperatingSystem>
<ProcessorSpeedMinimum>
<AmountMHz>120</AmountMHz>
</ProcessorSpeedMinimum>
<ProcessorSpeedRecommended>
<AmountMHz>400</AmountMHz>
</ProcessorSpeedRecommended>
<MemoryMinimum>
<Amount>256</Amount>
</MemoryMinimum>
<MemoryRecommended>
<Amount>512</Amount>
</MemoryRecommended>
<StorageSpaceMinimum>
<Amount>4</Amount>
</StorageSpaceMinimum>
<StorageSpaceRecommended>
<Amount>12</Amount>
</StorageSpaceRecommended>
</HostEnvironment>
    <evaluation>
        <Usability>
            <numberOfItems>1</numberOfItems>
            <value>4.0</value>
            <unit>utility</unit>
            <variance>0</variance>
            <min>4.0</min>
            <max>4.0</max>
            <description>Current average from miniMEE</description>
            <source>
                <SuppliedBy>
                    <Name>miniMEE</Name>
                    <URL>www.ifs.tuwien.ac.at/dp/minimee</URL>
                </SuppliedBy>
                <SuppliedAt>2009-07-30T08:34:34</SuppliedAt>
                <LastModifiedBy>
                    <Name>cb</Name>
                </LastModifiedBy>
                <LastModifiedAt>2009-07-30T08:34:34</LastModifiedAt>
            </source>
        </Usability>
    </evaluation>
<Source>
<SuppliedBy>
<Name>Administrator</Name>
<Website>http://www.institute.com/johndoe</Website>
<Mail>johndoe@institute.org</Mail>
</SuppliedBy>
<SuppliedAt>2002-05-30T09:00:00</SuppliedAt>
<LastModifiedBy>
<Name>AnotherAdministrator</Name>
<Website>http://www.institute.org/another</Website>
<Mail>another@institute.org</Mail>
</LastModifiedBy>
<LastModifiedAt>2002-05-30T09:30:00</LastModifiedAt>
</Source>
<OutputFormat>
    <File type="fmt/152" optional="false"/>
    <File type="x-fmt/399" optional="false"/>
    <File type="x-fmt/388" optional="false"/>
    <File type="x-fmt/7" optional="false"/>
    <File type="x-fmt/387" optional="false"/>
    <File type="x-fmt/8" optional="false"/>
</OutputFormat>
<BatchProcessing>true</BatchProcessing>
</MigrationTool>
</pcdl>
